{
  "$schema": "https://json-schema.org/draft/2020-12/schema",
  "$id": "https://example.local/stickman-storyboard.schema.json",
  "title": "Stickman video storyboard",
  "type": "array",
  "minItems": 1,
  "items": {
    "type": "object",
    "required": ["id"],
    "properties": {
      "id": {
        "type": "string",
        "pattern": "^[a-z0-9_-]+$"
      },
      "title": { "type": "string" },
      "narration": { "type": "string" },
      "narration_segments": {
        "type": "array",
        "minItems": 1,
        "items": {
          "type": "object",
          "required": ["text"],
          "properties": {
            "text": { "type": "string", "minLength": 1 },
            "caption": { "type": "string" },
            "audio_file": { "type": "string" },
            "pause_after": { "type": "number", "minimum": 0 }
          },
          "additionalProperties": false
        }
      },
      "caption": { "type": "string" },
      "background": { "type": "string" },
      "audio_file": { "type": "string" },
      "duration": { "type": "number", "exclusiveMinimum": 0 },
      "min_duration": { "type": "number", "exclusiveMinimum": 0 },
      "tail_pad": { "type": "number", "minimum": 0 },
      "camera": {
        "enum": ["static", "zoom_in", "zoom_out", "pan_left", "pan_right"]
      },
      "characters": {
        "type": "array",
        "items": {
          "type": "object",
          "properties": {
            "x": { "type": "number" },
            "y": { "type": "number" },
            "scale": { "type": "number", "exclusiveMinimum": 0 },
            "rotation": { "type": "number" },
            "pose": {
              "enum": ["stand", "look_down", "point", "arms_up", "think", "walk"]
            },
            "expression": {
              "enum": ["neutral", "smile", "confused", "surprised", "sad", "angry"]
            },
            "shirt": { "type": "string" },
            "skin": { "type": "string" },
            "clothing": { "enum": ["shirt", "hide"] }
          },
          "additionalProperties": false
        }
      },
      "props": {
        "type": "array",
        "items": {
          "type": "object",
          "required": ["type"],
          "properties": {
            "type": {
              "enum": ["arrow", "cross", "bubble", "node", "mirror", "arc", "star"]
            }
          },
          "additionalProperties": true
        }
      },
      "connections": {
        "type": "array",
        "items": {
          "type": "object",
          "required": ["x1", "y1", "x2", "y2"],
          "properties": {
            "x1": { "type": "number" },
            "y1": { "type": "number" },
            "x2": { "type": "number" },
            "y2": { "type": "number" },
            "color": { "type": "string" },
            "width": { "type": "number" }
          },
          "additionalProperties": false
        }
      }
    },
    "additionalProperties": false
  }
}
